[
  {
    "source_file": "INV-2026-0876.pdf",
    "pages": [
      1,
      1
    ],
    "document_type": "invoice",
    "document_id": "INV-2026-0876",
    "supersedes": null,
    "duplicate_of": null,
    "fields": {
      "invoice_number": {
        "confidence": "high",
        "value": "INV-2026-0876",
        "evidence": "page 1, header block, right-hand key/value column"
      },
      "client_name": {
        "confidence": "high",
        "value": "Oakhaven Logistics Collective",
        "evidence": "page 1, BILL TO block, top left"
      },
      "engagement_ref": {
        "confidence": "high",
        "value": "SOW-2026-002",
        "evidence": "page 1, header block, right-hand key/value column"
      },
      "purchase_order": {
        "confidence": "high",
        "value": "PO-80678",
        "evidence": "page 1, header block, right-hand key/value column"
      },
      "billing_period": {
        "confidence": "high",
        "value": "2026-06",
        "evidence": "page 1, header block, right-hand key/value column"
      },
      "issue_date": {
        "confidence": "high",
        "value": "2026-07-09",
        "evidence": "page 1, header block, right-hand key/value column"
      },
      "due_date": {
        "confidence": "high",
        "value": "2026-08-08",
        "evidence": "page 1, header block, right-hand key/value column"
      },
      "subtotal": {
        "confidence": "high",
        "value": "79912.83",
        "evidence": "page 1, totals block, bottom right"
      },
      "retainer_credit": {
        "confidence": "high",
        "value": "-9814.23",
        "evidence": "page 1, totals block, bottom right"
      },
      "net_amount": {
        "confidence": "high",
        "value": "70098.60",
        "evidence": "page 1, totals block, bottom right"
      },
      "tax_amount": {
        "confidence": "high",
        "value": "14019.72",
        "evidence": "page 1, totals block, bottom right"
      },
      "total_due": {
        "confidence": "high",
        "value": "84118.32",
        "evidence": "page 1, totals block, bottom right"
      },
      "payment_terms": {
        "confidence": "high",
        "value": "Net 30 days from date of issue",
        "evidence": "page 1, payment terms line below the totals block"
      }
    }
  },
  {
    "source_file": "INV-2026-0906.pdf",
    "pages": [
      1,
      1
    ],
    "document_type": "invoice",
    "document_id": "INV-2026-0906",
    "supersedes": null,
    "duplicate_of": null,
    "fields": {
      "invoice_number": {
        "confidence": "high",
        "value": "INV-2026-0906",
        "evidence": "page 1, header block, right-hand key/value column"
      },
      "client_name": {
        "confidence": "high",
        "value": "Ashcombe Health Partners",
        "evidence": "page 1, BILL TO block, top left"
      },
      "engagement_ref": {
        "confidence": "high",
        "value": "SOW-2026-003",
        "evidence": "page 1, header block, right-hand key/value column"
      },
      "purchase_order": {
        "confidence": "high",
        "value": "PO-57052",
        "evidence": "page 1, header block, right-hand key/value column"
      },
      "billing_period": {
        "confidence": "high",
        "value": "2026-05",
        "evidence": "page 1, header block, right-hand key/value column"
      },
      "issue_date": {
        "confidence": "high",
        "value": "2026-06-04",
        "evidence": "page 1, header block, right-hand key/value column"
      },
      "due_date": {
        "confidence": "high",
        "value": "2026-07-04",
        "evidence": "page 1, header block, right-hand key/value column"
      },
      "subtotal": {
        "confidence": "high",
        "value": "17337.79",
        "evidence": "page 1, totals block, bottom right"
      },
      "retainer_credit": {
        "confidence": "high",
        "value": "-1293.79",
        "evidence": "page 1, totals block, bottom right"
      },
      "net_amount": {
        "confidence": "high",
        "value": "16044.00",
        "evidence": "page 1, totals block, bottom right"
      },
      "tax_amount": {
        "confidence": "high",
        "value": "3208.80",
        "evidence": "page 1, totals block, bottom right"
      },
      "total_due": {
        "confidence": "high",
        "value": "19252.80",
        "evidence": "page 1, totals block, bottom right"
      },
      "payment_terms": {
        "confidence": "high",
        "value": "Net 30 days from date of issue",
        "evidence": "page 1, payment terms line below the totals block"
      }
    }
  },
  {
    "source_file": "INV-2026-0966.pdf",
    "pages": [
      1,
      1
    ],
    "document_type": "invoice",
    "document_id": "INV-2026-0966",
    "supersedes": null,
    "duplicate_of": null,
    "fields": {
      "invoice_number": {
        "confidence": "high",
        "value": "INV-2026-0966",
        "evidence": "page 1, header block, right-hand key/value column"
      },
      "client_name": {
        "confidence": "high",
        "value": "Pentland Media Group",
        "evidence": "page 1, BILL TO block, top left"
      },
      "engagement_ref": {
        "confidence": "high",
        "value": "SOW-2026-005",
        "evidence": "page 1, header block, right-hand key/value column"
      },
      "purchase_order": {
        "confidence": "high",
        "value": "PO-58393",
        "evidence": "page 1, header block, right-hand key/value column"
      },
      "billing_period": {
        "confidence": "high",
        "value": "2026-07",
        "evidence": "page 1, header block, right-hand key/value column"
      },
      "issue_date": {
        "confidence": "high",
        "value": "2026-07-25",
        "evidence": "page 1, header block, right-hand key/value column"
      },
      "due_date": {
        "confidence": "high",
        "value": "2026-08-24",
        "evidence": "page 1, header block, right-hand key/value column"
      },
      "subtotal": {
        "confidence": "high",
        "value": "33546.78",
        "evidence": "page 1, totals block, bottom right"
      },
      "retainer_credit": {
        "confidence": "high",
        "value": "-5830.44",
        "evidence": "page 1, totals block, bottom right"
      },
      "net_amount": {
        "confidence": "high",
        "value": "27716.34",
        "evidence": "page 1, totals block, bottom right"
      },
      "tax_amount": {
        "confidence": "high",
        "value": "5543.27",
        "evidence": "page 1, totals block, bottom right"
      },
      "total_due": {
        "confidence": "high",
        "value": "33259.61",
        "evidence": "page 1, totals block, bottom right"
      },
      "payment_terms": {
        "confidence": "high",
        "value": "Net 30 days from date of issue",
        "evidence": "page 1, payment terms line below the totals block"
      }
    }
  },
  {
    "source_file": "INV-2026-1038.pdf",
    "pages": [
      1,
      1
    ],
    "document_type": "invoice",
    "document_id": "INV-2026-1038",
    "supersedes": null,
    "duplicate_of": null,
    "fields": {
      "invoice_number": {
        "confidence": "high",
        "value": "INV-2026-1038",
        "evidence": "page 1, header block, right-hand key/value column"
      },
      "client_name": {
        "confidence": "high",
        "value": "Braemar Retail Corporation",
        "evidence": "page 1, BILL TO block, top left"
      },
      "engagement_ref": {
        "confidence": "high",
        "value": "SOW-2026-007",
        "evidence": "page 1, header block, right-hand key/value column"
      },
      "purchase_order": {
        "confidence": "high",
        "value": "PO-65296",
        "evidence": "page 1, header block, right-hand key/value column"
      },
      "billing_period": {
        "confidence": "high",
        "value": "2026-06",
        "evidence": "page 1, header block, right-hand key/value column"
      },
      "issue_date": {
        "confidence": "high",
        "value": "2026-07-03",
        "evidence": "page 1, header block, right-hand key/value column"
      },
      "due_date": {
        "confidence": "high",
        "value": "2026-08-02",
        "evidence": "page 1, header block, right-hand key/value column"
      },
      "subtotal": {
        "confidence": "high",
        "value": "32064.86",
        "evidence": "page 1, totals block, bottom right"
      },
      "retainer_credit": {
        "confidence": "high",
        "value": "-4422.78",
        "evidence": "page 1, totals block, bottom right"
      },
      "net_amount": {
        "confidence": "high",
        "value": "27642.08",
        "evidence": "page 1, totals block, bottom right"
      },
      "tax_amount": {
        "confidence": "high",
        "value": "5528.42",
        "evidence": "page 1, totals block, bottom right"
      },
      "total_due": {
        "confidence": "high",
        "value": "33170.50",
        "evidence": "page 1, totals block, bottom right"
      },
      "payment_terms": {
        "confidence": "high",
        "value": "Net 30 days from date of issue",
        "evidence": "page 1, payment terms line below the totals block"
      }
    }
  },
  {
    "source_file": "INV-2026-1146.pdf",
    "pages": [
      1,
      1
    ],
    "document_type": "invoice",
    "document_id": "INV-2026-1146",
    "supersedes": null,
    "duplicate_of": null,
    "fields": {
      "invoice_number": {
        "confidence": "high",
        "value": "INV-2026-1146",
        "evidence": "page 1, header block, right-hand key/value column"
      },
      "client_name": {
        "confidence": "high",
        "value": "Stonebridge Energy Group",
        "evidence": "page 1, BILL TO block, top left"
      },
      "engagement_ref": {
        "confidence": "high",
        "value": "SOW-2026-012",
        "evidence": "page 1, header block, right-hand key/value column"
      },
      "purchase_order": {